<?xml version="1.0" encoding="UTF-8"?>
<!DOCTYPE project SYSTEM "project_record.dtd">
<project>
    <title></title>
    <body>
        <header>
            <key_name></key_name>
            <title>titulo</title>
            <date></date>
            <date></date>
            <supervisor url=""></supervisor>
        </header>
        <workteam>
            <elem>
                <name></name>
            </elem>
        </workteam>
        <abstract>
            <paragraph></paragraph>
        </abstract>
        <deliverables>
            <link url=""></link>
        </deliverables>
    </body>
    <date></date>
</project>