<?xml version="1.0" encoding="UTF-8"?>
<!DOCTYPE project SYSTEM "project_record.dtd">
<project>
    <title>Project Record</title>
    <body>
        <header>
            <key_name>Project Record - TP2</key_name>
            <title>Trabalho Pratico 2</title>
            <date>22 Outubro 2020</date>
            <date>24 Outubro 2020</date>
            <supervisor url="http://www4.di.uminho.pt/~jcr/">
                Jos√© Carlos Ramalho
            </supervisor>
        </header>
        <workteam>
            <elem>
                <name>Luis Miguel Arieira Ramos</name>
            </elem>
        </workteam>
        <abstract>
            <paragraph>
                Por <bold>preencher</bold>
            </paragraph>
        </abstract>
        <deliverables>
            <link>
                <external_link url="www.gmail.com">
                    Gmail
                </external_link>
            </link>
        </deliverables>
    </body>
    <date>2020</date>
</project>